129-message-2025-10-14-16-10-18,2025-10-14 16:10:22 +08:00,柯志恩烏龍爆料  高市府嚴厲譴責：惡意政治操作、抹黑！,,"高雄,柯志恩,民進黨文宣",https://cdn.jsdelivr.net/gh/TRocket-Go/tbullet-image-2025-10@129-message-2025-10-14-16-10-18/img/129-message-2025-10-14-16-10-18-img-1.webp,"柯志恩烏龍爆料

高市府嚴厲譴責：惡意政治操作、抹黑！

小港大坪頂污水工程暫置場一事，市府有必要就事實做個澄清。

柯志恩委員10月9日稱保護區不能作為暫置或開採，但六都法律規定非常清楚：保護區內可作為公用事業的土石堆放使用，新北市就有一處作為土資場。

去(113)年3月26日水利局依法核定進行小港污水系統工程相關暫置場域。

柯委員一再用不實資料，稱保護區不能放置，已被市府澄清事實，卻仍持續散播不實訊息。水利局也多次說明，廠商去年已完成水保工程。一而再、再而三用不實資料進行抹黑、政治操作，高雄市政府無法接受。我們有義務向市民說明事件經過與澄清事實真相。

昨天也扯到說是不是誰在包庇護航？關心此案的正是國民黨議員，前後關心八次、居中協調，釐清相關法律與代辦事項。若這叫包庇護航，豈非國民黨議員在包庇護航？爆料前難道不用查證？不用向市府詢問？問同黨議員就知道來龍去脈。

我們不希望市政建設推動因選舉而扭曲。法律怎麼規定，我們就按照法律執行，任何人當市長都一樣，必須依法行政，這是我們的原則。

此區域為公用事業工程合法暫置使用，並非盜採濫填情事。

市府有必要澄清不實指控，也不希望因政治攻防抹黑基層公務員，我們必須捍衛同仁清白。

柯志恩委員等民代一再以不實資料抹黑，進行政治操作，高市府表達嚴厲譴責。",
