28-message-2025-09-03-12-13-43,2025-09-03 12:13:56 +08:00,藍委喊「窮台灣」？上半年經濟表現會說話！,,"經濟表現,民進黨文宣","https://cdn.jsdelivr.net/gh/TRocket-Go/tbullet-image-2025-9@28-message-2025-09-03-12-13-43/img/28-message-2025-09-03-12-13-43-img-1.webp,https://cdn.jsdelivr.net/gh/TRocket-Go/tbullet-image-2025-9@28-message-2025-09-03-12-13-43/img/28-message-2025-09-03-12-13-43-img-2.webp,https://cdn.jsdelivr.net/gh/TRocket-Go/tbullet-image-2025-9@28-message-2025-09-03-12-13-43/img/28-message-2025-09-03-12-13-43-img-3.webp,https://cdn.jsdelivr.net/gh/TRocket-Go/tbullet-image-2025-9@28-message-2025-09-03-12-13-43/img/28-message-2025-09-03-12-13-43-img-4.webp","藍委喊「窮台灣」？上半年經濟表現會說話！

#國民黨 立委整天開口閉口就是「窮台灣」，加入國民黨團的 #高金素梅 昨天更說「窮台的不是中國，而是美國和民進黨自己」、「台灣應該拒絕跟美國貿易往來」。

但事實真的是這樣嗎？數據會說話，台灣經濟表現比國民黨想像得還要亮眼！

2025年出口、進口年增率，台灣居主要國家/地區之冠！
台灣出口值成長再成長！
經濟成長率更為亞洲四小龍之首！

而且，台灣出口持續成長，很大一部分來自「對美出超」，也就是產品賣給美國、賺美金，支撐了台灣的經濟！

能這些成果，是來自台灣勞工和企業、人民與政府的共同努力，大家一起拚出來的堅實基礎。台灣的腳步不只沒有停下，更在挑戰中持續前進，繼續在世界舞台發光發熱！

不論高金素梅和國民黨怎麼唱衰，我們都會繼續努力拚經濟！",
